Country,Name,"Year Passed",Executive/Legislative,Framework,Categories,"Document Type"
"European Union","Emission performance standards for new passenger cars (Regulation (EC) No. 443/2009 setting emission performance standards for new passenger cars as part of the Community’s integrated approach to reduce CO2 emissions from light-duty vehicles)",2009,Legislative,No,"Carbon Pricing; Transportation","EU regulation"
Russia,"Energy Efficiency legislation (Federal Law 261-F3 on Saving Energy and Increasing Energy Efficiency Increase and Amending Certain Legislative Acts of the Russian Federation)",2009,Legislative,,"Energy Demand; Institutions / Administrative arrangements",Law
Poland,"Energy Policy of Poland until 2030 (EPP 2030)",2009,Executive,,"Energy Demand; Energy Supply; Institutions / Administrative arrangements; Research and development; Transportation",Policy
Russia,"Energy Strategy to 2030",2009,Executive,,"Energy Supply",Strategy
"European Union","Fuel Quality (Directives 2009/30/EC and 2015/1513 amending Directive 98/70/EC as regards the specification of petrol, diesel and gas-oil and introducing a mechanism to monitor and reduce GHG emissions and amending Council Directive 1999/32/EC as regards the specification of fuel used by inland waterway vessels and repealing Directive 93/12/EEC)",2009,Legislative,No,"Energy Demand; Energy Supply; Transportation","EU directive"
"European Union","Geological storage of carbon dioxide (Directive 2009/31/EC on the geological storage of carbon dioxide and amending Council Directive 85/337/EEC, European Parliament and Council Directives 2000/60/EC, 2001/80/EC, 2004/35/EC, 2006/12/EC, 2008/1/EC and Regulation (EC) No  1013/2006)",2009,Legislative,Mitigation,"Carbon Pricing; Energy Supply; Research and development","EU directive"
Tajikistan,"Government Order No.73 on the Long-term Programme for Building Hydropower Plants for 2009-2020",2009,Executive,,"Energy Supply",Decree/order/ordinance
Denmark,"Green Transport Policy Agreement",2009,Executive,,"Energy Demand; Transportation",Policy
France,"Grenelle I",2009,Legislative,,"Energy Demand; Energy Supply; Institutions / Administrative arrangements; REDD+ and LULUCF; Transportation",Law
Netherlands,"Heat Act",2009,Legislative,,"Energy Demand; Energy Supply",Law
Ukraine,"Law 1391-VI on Promotion of Biological Fuels Production and Use",2009,Legislative,,"Energy Demand; Energy Supply; Institutions / Administrative arrangements; Research and development; Transportation",Law
Kazakhstan,"Law about Support of Use of Renewable Sources of Energy No. 165-4",2009,Legislative,,"Energy Supply; Research and development",Law
Italy,"Law concerning anti-crisis measures: energy provisions (Law no. 102)",2009,Legislative,,"Energy Demand",Law
Croatia,"Law on Biofuels for Transport",2009,Legislative,,"Energy Demand; Energy Supply; Institutions / Administrative arrangements; Transportation",Law
Denmark,"Law on the Promotion of Renewable Energy –  No. 1392/2008 (and Legislative Decree 1288/2016)",2009,Legislative,,"Energy Demand; Energy Supply; Transportation",Law
Russia,"Legislation on the limitations of associated gas flaring",2009,Executive,,"Energy Supply",Law
Malta,"Motor Vehicles Registration Tax (Amendment) Act, 2009",2009,Legislative,,"Carbon Pricing; Transportation",Law
Malta,"National Strategy for Policy and Abatement Measures Relating to the Reduction of Greenhouse Gas Emissions",2009,Executive,,"Carbon Pricing; Energy Demand; Energy Supply; Institutions / Administrative arrangements; Transportation",Strategy
Russia,"On the Measures of Implementing Article 6 of the Kyoto Protocol to the United Nations Framework Convention on Climate Change (Government Decree No. 844)",2009,Executive,,"Institutions / Administrative arrangements",Decree/order/ordinance
Denmark,"Planning Act (No. 937 of 2009; consolidated No. 587 of 2013; no. 50/2018)",2009,Legislative,,"Adaptation; Energy Demand; Institutions / Administrative arrangements; REDD+ and LULUCF; Transportation",Law
Germany,"Power Grid Expansion Act (EnLAG)",2009,Legislative,No,"Energy Supply; Institutions / Administrative arrangements",Law
Bulgaria,"Programme for accelerated gasification of Republic of Bulgaria until 2020",2009,Executive,,"Energy Demand",Programme
"European Union","Regulation No 1222/2009 on the labelling of tyres with respect to fuel efficiency and other essential parameters",2009,Legislative,No,"Energy Demand; Institutions / Administrative arrangements","EU regulation"
Poland,"Regulation of the Council of Ministers on types of programmes and projects to be implemented under the National Green Investment Scheme (GIS)",2009,Legislative,,"Energy Demand; Energy Supply; Institutions / Administrative arrangements; REDD+ and LULUCF; Research and development; Transportation",Law
Slovenia,"Regulation on Forest Protection",2009,Executive,,Adaptation,Regulation/rules
Slovakia,"Renewable Energy Act  (Act 309/2009 on Promotion of Renewable Energy Sources and High-efficiency Cogeneration and on amendments to certain acts)",2009,Legislative,,"Energy Supply",Law
Iceland,"Renewable Energy Action Plan",2009,Executive,No,"Energy Demand; Energy Supply; Research and development; Transportation",Plan
Uzbekistan,"Resolution of the Cabinet of Ministers No. 245 validating the Regulation on use of electric and thermal energy",2009,Executive,,"Energy Demand; Energy Supply; Institutions / Administrative arrangements",Regulation/rules
"European Union","Revision of the EU Emission Trading System (EU ETS) (Directive 2009/29/EC amending Directive 2003/87/EC so as to improve and extend the greenhouse gas emission allowance trading scheme of the Community)",2009,Legislative,No,"Carbon Pricing; Energy Supply; Institutions / Administrative arrangements; REDD+ and LULUCF; Transportation","EU directive"
Ireland,"Smarter Travel – A Sustainable Transport Future: A New Transport Policy for Ireland 2009-2020",2009,Executive,,"Energy Demand; Energy Supply; Institutions / Administrative arrangements; Research and development; Transportation",Policy
Croatia,"Strategy for Sustainable Development of the Republic of Croatia",2009,Executive,,"Adaptation; Energy Demand; Energy Supply; Institutions / Administrative arrangements; Research and development; Transportation",Strategy
Belarus,"Tax relief for renewable energy investors (Decree No 10 of 6 August 2009 on additional conditions for investment activities as amended; Tax Code of Belarus of 29 December 2009, No 71-W)",2009,Executive,,"Energy Supply; Institutions / Administrative arrangements",Decree/order/ordinance
Denmark,"The Forest Act No. 945",2009,Legislative,,"Adaptation; REDD+ and LULUCF",Law
"European Union","Third Energy Package (Directive on electricity 2009/72/EC, repealing Directive 2003/54/EC and Directive on gas 2009/73/EC, repealing Directive 2003/55/EC)",2009,Legislative,No,"Energy Supply; Institutions / Administrative arrangements","EU directive"
Norway,"Value Added Tax (VAT) Act No. 58 of 2009",2009,Legislative,,"Energy Demand; Institutions / Administrative arrangements",Law
Iceland,"Act no. 30 of 2008 (on the guarantee of origin of electricity produced from renewable energy sources)",2008,Legislative,No,"Energy Supply",Law
Belarus,"Act No. 426-N on the use of nuclear power",2008,Legislative,,"Energy Supply",Law
Slovakia,"Act No. 476/2008 on Energy Efficiency and on the amendment of Act 555/2005 on energy efficiency of buildings and on changes and amendments of certain acts",2008,Legislative,,"Energy Demand; Energy Supply",Law
"United Kingdom","Climate Change Act",2008,Legislative,"Mitigation and adaptation","Adaptation; Carbon Pricing; Energy Demand; Energy Supply; Institutions / Administrative arrangements; Research and development; Transportation",Law
Denmark,"Danish strategy for adaptation to a changing climate (2008) and the Action Plan for a climate-proof Denmark (2012)",2008,Executive,Adaptation,"Adaptation; Institutions / Administrative arrangements; Research and development",Strategy
Bulgaria,"Energy Efficiency Act (repeals the Law on Energy Efficiency 2004)",2008,Legislative,,"Energy Demand; Institutions / Administrative arrangements",Law
Slovakia,"Energy Security Strategy of the Slovak Republic, Resolution of the Government No. 732/2008 Coll.",2008,Executive,,"Energy Supply",Resolution
Italy,"Finance Law 2008 (Law No. 244 24/12/2007 and Law No. 222 29/11/2007); M.D. 18.12.08; Law 99/09)",2008,Legislative,,"Carbon Pricing; Energy Supply",Law
Germany,"German Strategy for Adaptation to Climate Change (DAS)",2008,Executive,Adaptation,Adaptation,Strategy
Hungary,"Governmental Decree No.176 of 2008 on certification of buildings energetic features",2008,Executive,,"Energy Demand",Decree/order/ordinance
Hungary,"Governmental Decree No.2019 of 2008 adopting the National Energy Efficiency Action Plan",2008,Executive,,"Energy Demand",Decree/order/ordinance
Tajikistan,"Governmental Order No.189 on the Committee on Environmental Protection",2008,Executive,,"Institutions / Administrative arrangements",Policy
Greece,"Law 3661/2008 on Measures to reduce energy consumption in buildings and other provisions",2008,Legislative,,"Energy Demand",Law
Romania,"Law no 220/2008 for the promotion of energy production from renewable energy sources",2008,Legislative,No,"Energy Supply; Institutions / Administrative arrangements",Law
"San Marino","Law no 72 on the promotion of energy efficiency in the housing sector and of renewable energy in the public and industrial sectors",2008,Legislative,mitigation,"Energy Demand; Energy Supply",Law
Kyrgyzstan,"Law No. 283 “On renewable sources of energy”",2008,Legislative,No,"Energy Supply",Law
Liechtenstein,"Law on Energy Efficiency",2008,Legislative,No,"Energy Demand; Energy Supply",Law
Switzerland,"Mineral Oil Tax reduction on Biofuels and Natural Gas (Mineral Oil Tax Act) (amendment)",2008,Legislative,,"Carbon Pricing; Energy Demand; Transportation",Law
Hungary,"National Climate Change Strategy (Resolution of the Parliament no 29/2008)",2008,Legislative,,"Adaptation; Energy Demand; Energy Supply; REDD+ and LULUCF",Law
Montenegro,"National Forestry Policy",2008,Executive,No,"REDD+ and LULUCF",Policy
Norway,"Planning and Building Act No. 71 of 2008",2008,Legislative,,"Energy Supply; Institutions / Administrative arrangements; Transportation",Law
"European Union","Regulation (EC) No 106/2008 on a Community energy-efficiency labelling programme for office equipment",2008,Legislative,No,"Energy Demand","EU regulation"
Germany,"Renewable Energies Heat Act (EEWärmeG)",2008,Legislative,,"Energy Demand; Energy Supply",Law
Azerbaijan,"State Program on Poverty Reduction and Sustainable Development in the Republic of Azerbaijan for 2008-2015",2008,Executive,No,"Energy Supply; Institutions / Administrative arrangements",Programme
Armenia,"Sustainable Development Programme (2008)",2008,Executive,No,Adaptation,Programme
Turkey,"Act No. 5627 on Energy Efficiency",2007,Legislative,,"Energy Demand; Energy Supply; Institutions / Administrative arrangements",Law
Turkey,"Act No. 5686 on Geothermal Resources And Mineral Waters",2007,Legislative,,"Energy Demand; Energy Supply; Research and development",Law
Slovakia,"Act. 609/2007 on Excise tax from electricity, coal and natural gas",2007,Legislative,,"Carbon Pricing; Energy Demand; Energy Supply",Law
Austria,"Austrian Forestry Programme",2007,Executive,,"REDD+ and LULUCF",Programme
Germany,"Biofuel Quota Act (BioKraftQuG)",2007,Legislative,,"Energy Supply; Institutions / Administrative arrangements; Transportation",Law
France,"Bonus-Malus: vehicle CO2 bonus and penalty system",2007,Executive,,Transportation,Policy
Ireland,"Carbon Fund Act 2007, Number 12 of 2007",2007,Legislative,,"Carbon Pricing; Institutions / Administrative arrangements",Law
"European Union","Clean Sky (Council Regulation (EC) No. 71/2007 setting up the Clean Sky Joint Undertaking and No 558/2014 of 6 May 2014 establishing the Clean Sky 2 Joint Undertaking)",2007,Legislative,No,"Research and development; Transportation","EU regulation"
Austria,"Climate and Energy Fund Act",2007,Legislative,,"Energy Demand; Institutions / Administrative arrangements; Research and development; Transportation",Law
Italy,"Climate Change Action Plan (CIPE Deliberation No. 135/2007)",2007,Executive,Mitigation,"Energy Demand",Plan
Belarus,"Concept of Energy Security of the Republic of Belarus (Decree of the President of the Republic of Belarus No.433)",2007,Executive,,"Energy Demand; Energy Supply",Decree/order/ordinance
Belarus,"Directive No.3 on the Economy and Savings as the Main Factors of the Economic Security of the State",2007,Executive,,"Energy Demand; Energy Supply; Institutions / Administrative arrangements; Research and development",Directive
Liechtenstein,"Energy Efficiency Evidence Act",2007,Legislative,No,"Energy Demand",Law
Ireland,"Energy White Papers on “Delivering a Sustainable Energy Future for Ireland? : The Energy Policy Framework 2007-2020”",2007,Executive,,"Energy Demand; Energy Supply; Research and development",Policy
Denmark,"Environment protection Act, no. 1757 of 22 December 2006 (updated: No. 879 of 2010; no. 966/2017)",2007,Legislative,,"Adaptation; Institutions / Administrative arrangements; REDD+ and LULUCF; Transportation",Law
Croatia,"Environmental Protection Act",2007,Legislative,,"REDD+ and LULUCF",Law
Tajikistan,"Governmental Order No.41 on the Complex Programme for the Widespread Use of Renewable Energy Sources",2007,Executive,,"Energy Demand; Energy Supply",Decree/order/ordinance
Germany,"Integrated Climate and Energy Programme (IEKP)",2007,Executive,,"Energy Demand; Energy Supply; Research and development; Transportation",Programme
Spain,"Law 34/2007  on air quality and atmosphere protection, last amended by Law 11/2014",2007,Legislative,,Transportation,Law
Romania,"Law for energy performance of buildings 372/2005",2007,Legislative,,"Energy Demand",Law
Kyrgyzstan,"Law no 71/2007 about state regulation and policy in the field of emission and absorption of greenhouse gases",2007,Legislative,No,"Energy Supply; Institutions / Administrative arrangements",Law
"United Kingdom","Low Carbon Transport Innovation Strategy",2007,Executive,,"Carbon Pricing; Energy Demand; Research and development; Transportation",Strategy
Estonia,"National Environmental Strategy until 2030",2007,Executive,No,"Energy Demand; Energy Supply; REDD+ and LULUCF; Transportation",Strategy
Slovenia,"National Forest Program",2007,Executive,,"REDD+ and LULUCF",Programme
Armenia,"National Programme for Energy Saving and Renewable Energy",2007,Executive,No,"Energy Demand; Energy Supply",Programme
Netherlands,"National Programme for Spatial Adaptation to Climate Change (ARK), (April 2007)Implementation via the National Adaptation Strategy (November 2007), 7222",2007,Executive,Adaptation,"Energy Demand; REDD+ and LULUCF","Out of date"
Montenegro,"National Strategy for Sustainable Development to 2030",2007,Executive,No,"Adaptation; Energy Demand; Energy Supply; REDD+ and LULUCF; Research and development; Transportation",Strategy
Netherlands,"New Energy for Climate Policy: The Clean and Efficient Programme (CEP)",2007,Executive,,"Adaptation; Carbon Pricing; Energy Demand; Energy Supply; Institutions / Administrative arrangements; REDD+ and LULUCF; Research and development; Transportation",Programme
Italy,"New Feed-In premium for photovoltaic systems (Ministerial Decree)",2007,Executive,,"Energy Supply",Decree/order/ordinance
Spain,"Spanish Strategy for Climate Change and Clean Energy  and the related Plan of Urgent Measures",2007,Executive,Mitigation,"Adaptation; Energy Demand; Energy Supply; Institutions / Administrative arrangements; Research and development; Transportation",Strategy
Kazakhstan,"The Ecological Code of the Republic of Kazakhstan, No. 212 of 2007and Amendment to said legislation on 3 December 2011",2007,Legislative,,"Carbon Pricing; Energy Demand; Energy Supply",Law
Slovakia,"Act No 555/2005 Coll. on Energy efficiency certification of buildings",2006,Legislative,,"Energy Demand; Institutions / Administrative arrangements",Law
Poland,"Act on Biocomponents and Liquid Biofuels (Dz.U. 2006 nr 169 poz. 1199)",2006,Legislative,,"Energy Supply",Law
Luxembourg,"Action Plan towards the reduction of greenhouse gases emissions",2006,Executive,mitigation,"Energy Demand; Energy Supply; Institutions / Administrative arrangements; Research and development; Transportation",Plan
Bulgaria,"Clean Ambient Air Act",2006,Legislative,,"Institutions / Administrative arrangements",Law
"United Kingdom","Climate Change and Sustainable Energy Act",2006,Legislative,,"Energy Demand; Energy Supply; Institutions / Administrative arrangements",Law
"United Kingdom","Climate Change Programme 2006",2006,Executive,,"Carbon Pricing; Energy Demand; Energy Supply; Transportation",Programme
"United Kingdom","Code for Sustainable Homes",2006,Executive,,"Energy Demand",Policy
Portugal,"Council of Ministers Resolutions 104/2006 and 1/2008, establishes and amends the National Climate Change Programme (PNAC)",2006,Executive,Mitigation,"Adaptation; Carbon Pricing; Energy Demand; Energy Supply; Institutions / Administrative arrangements; REDD+ and LULUCF; Research and development; Transportation",Programme
Portugal,"Decree-Law 71/2006 on the Portuguese Carbon Fund",2006,Executive,,"Carbon Pricing; Energy Demand; Energy Supply; Institutions / Administrative arrangements; REDD+ and LULUCF; Research and development","Decree law"
Slovenia,"Environmental Protection Act",2006,Legislative,Mitigation,"Carbon Pricing; Energy Demand; Energy Supply; Institutions / Administrative arrangements; Research and development; Transportation",Law
Greece,"Law L3468/2006 on the Generation of electricity from renewable energy sources and through high-efficiency co-generation of electricity and heat and miscellaneous provisions",2006,Legislative,,"Energy Supply",Law
Spain,"National Climate Change Adaptation Plan",2006,Executive,Adaptation,"Adaptation; Energy Demand; Energy Supply; Institutions / Administrative arrangements; REDD+ and LULUCF; Research and development; Transportation",Plan
Belarus,"Regulation of the National Greenhouse Gas Inventory System (Resolution of the Council of Ministers of the Republic of Belarus No. 585)",2006,Executive,,"Institutions / Administrative arrangements",Resolution
Belgium,"Royal Decree on the Tax Regulation Mechanism and Excise Duty Exemptions for Rapeseed Oil Biofuels",2006,Executive,,"Energy Supply",Decree/order/ordinance
Belarus,"State Commission for Climate Change Problems (Resolution of the Council of Ministers of the Republic of Belarus No. 1145)",2006,Executive,,"Institutions / Administrative arrangements",Resolution
Kazakhstan,"The Concept of Transition of the Republic of Kazakhstan to Sustainable Development for the Period 2007-2024, Presidential Decree No 216 of 2006",2006,Executive,,"Adaptation; Energy Demand; Energy Supply; Institutions / Administrative arrangements; REDD+ and LULUCF; Research and development; Transportation",Decree/order/ordinance
Turkey,"Act No. 5346 on Utilization of Renewable Energy Sources for the Purposes of Generating Electrical Energy (Renewable Energy Law)",2005,Legislative,,"Energy Demand; Energy Supply; Institutions / Administrative arrangements; Research and development",Law
Turkey,"Act No. 5403 on Soil Conservation and Land Use",2005,Legislative,,"Adaptation; Institutions / Administrative arrangements; REDD+ and LULUCF",Law
Belgium,"Act-Programme (including the Creation of the Fund for General Reduction of Energy Costs)",2005,Legislative,,"Energy Demand; Institutions / Administrative arrangements",Law
Slovakia,"Act. No. 587/2004 Coll. on Environmental Fund",2005,Legislative,,"Energy Demand; Institutions / Administrative arrangements; REDD+ and LULUCF; Research and development; Transportation",Law
Italy,"Biofuel (Decree no. 128/2005 and Ministerial Decree of 13-dec-17)",2005,Executive,,"Energy Supply",Decree/order/ordinance
Germany,"Energy Industry Act (EnWG)",2005,Legislative,,"Energy Demand; Energy Supply; Institutions / Administrative arrangements",Law
France,"Energy Policy Framework (POPE, No. 2005-781)",2005,Legislative,,"Energy Demand; Energy Supply; Institutions / Administrative arrangements; Research and development",Law
Croatia,"Forest Law",2005,Legislative,,"Institutions / Administrative arrangements",Law
Romania,"Government Urgency Ordinance on the Environmental Fund, 196/ 2005",2005,Executive,,"Institutions / Administrative arrangements",Policy
Ukraine,"Law 2509-IV on Combined Heat and Power (cogeneration) and Waste Energy Potential, Amended by Law 2592-VI, Code 2755-VI, Law 2856-VI, and Law 3610-VI of 07.07.2011",2005,Legislative,,"Energy Demand; Energy Supply; Institutions / Administrative arrangements; Research and development; Transportation",Law
Greece,"Law 3423/2005 on Introducing Biofuels and other Renewable Fuels to the Greek Market",2005,Legislative,,"Energy Supply; Transportation",Law
Spain,"Law no 1/2005 regulating the greenhouse gas emission rights trading scheme and creating the Climate Change Policy Coordination Commission (CCPCC)",2005,Legislative,mitigation,"Carbon Pricing; Institutions / Administrative arrangements",Law
"Macedonia (the former Yugoslav Republic of)","Law on Environment",2005,Executive,,"Energy Demand; Institutions / Administrative arrangements; Research and development; Transportation",Law
Ukraine,"National Action Plan on Implementation of the Kyoto Protocol, adopted through Resolution 346-p of the Cabinet of Ministers",2005,Executive,Mitigation,"Adaptation; Institutions / Administrative arrangements; Research and development",Plan
Armenia,"National Forest Programme",2005,Executive,No,"REDD+ and LULUCF",Programme
Portugal,"Resolution of Council of Ministers 68/2005, establishes the National System for the Estimation of Emissions by Sources and Removals by Sinks and Air Pollutants (SNIERPA)",2005,Executive,,"Institutions / Administrative arrangements; REDD+ and LULUCF; Research and development",Policy
Armenia,"Strategy for Development of the Energy Sector within the Context of Economic Development of Armenia",2005,Executive,No,"Energy Demand; Energy Supply",Resolution
Italy,"White Certificate Trading for End-Use Energy Efficiency",2005,Executive,,"Carbon Pricing; Energy Demand; Energy Supply; Institutions / Administrative arrangements",Policy
Finland,"Act on Verification and Notification of Origin of Electricity (1129/2003)",2004,Legislative,,"Energy Demand; Institutions / Administrative arrangements",Law
"European Union","Cogeneration (Directive 2004/8/EC on the promotion of cogeneration based on a useful heat demand in the internal energy market and amending Directive 92/42/EEC)",2004,Legislative,No,"Energy Supply","EU directive"
Netherlands,"Environmental Management Act 2004",2004,Legislative,,"Carbon Pricing; Energy Demand; Energy Supply; Transportation",Law
Norway,"Greenhouse Gas Emission Trading Act, No. 99 of 2004",2004,Legislative,,"Carbon Pricing",Law
Greece,"Law 3299/04 on Private Investment Incentives for Economic Development and Regional Convergence",2004,Legislative,,"Energy Demand; Energy Supply; Transportation",Law
"Macedonia (the former Yugoslav Republic of)","Law on Ambient Air Quality",2004,Legislative,,"Energy Demand; Institutions / Administrative arrangements",Law
Kazakhstan,"Law on Power Industry, No 588-II",2004,Legislative,,"Energy Supply",Law
"Czech Republic","National Programme to Abate the Climate Change Impacts, Government Resolution No. 187",2004,Executive,Mitigation,"Adaptation; Carbon Pricing; Energy Demand; Energy Supply; REDD+ and LULUCF; Transportation","Out of date"
Italy,"Reorganisation of Energy Sector Regulation (Law no. 239)",2004,Legislative,,"Energy Demand; Institutions / Administrative arrangements",Law
Uzbekistan,"Resolution of the Cabinet of Ministers No. 183 validating the Regulation on the State Hydrometeorological Service and Cabinet Decision no 606",2004,Executive,,"Institutions / Administrative arrangements; Research and development",Regulation/rules
Belgium,"Act on the Progressive Phase-out of Nuclear Energy from 2015 to 2025",2003,Legislative,,"Energy Supply",Law
Liechtenstein,"Clean Air Act",2003,Legislative,No,"Energy Supply",Law
Bulgaria,"Energy Act and the National Energy Strategy until 2020",2003,Legislative,,"Energy Demand; Energy Supply",Law
"European Union","Energy taxation (Directive 2003/96/EC of 27 October 2003 restructuring the Community framework for the taxation of energy products and electricity)",2003,Legislative,No,"Carbon Pricing; Energy Demand","EU directive"
Croatia,"Environmental Protection and Energy Efficiency Fund Act",2003,Legislative,,"Carbon Pricing; Energy Demand; Energy Supply; Institutions / Administrative arrangements; Transportation",Law
Kazakhstan,"Government Decree No 857, on wind energy development",2003,Executive,,"Energy Supply",Decree/order/ordinance
Ukraine,"Law 555 -IV on Alternative Energy Sources, amended by Law 601-VI",2003,Legislative,,"Energy Demand; Energy Supply; Institutions / Administrative arrangements; Research and development; Transportation",Law
Romania,"Law on the use of nuclear energy for exclusively peaceful purposes 321/2003 that approved the Government Ordinance no. 7/2003",2003,Legislative,,"Energy Supply; Institutions / Administrative arrangements; Research and development",Law
Tajikistan,"National Action Plan for Climate Change Mitigation",2003,Executive,"Mitigation and adaptation","Adaptation; Energy Demand; Energy Supply; Research and development",Plan
Azerbaijan,"National Program on Environmentally Sustainable Socio-economic Development for 2003-2010",2003,Executive,No,"Adaptation; Energy Demand; Energy Supply; Research and development",Programme
Albania,"National Strategy of Energy",2003,Executive,No,"Energy Supply",Strategy
