Country,Name,"Year Passed",Executive/Legislative,Framework,Categories,"Document Type"
Bulgaria,"National Strategy for Development of the Forestry Sector in the Republic of Bulgaria for the period 2013 – 2020",2013,Executive,,"REDD+ and LULUCF",Strategy
Kyrgyzstan,"National Sustainable Development Strategy for the Kyrgyz Republic",2013,Executive,No,"Energy Demand; Energy Supply",Strategy
Switzerland,"Ordinance for the Reduction of CO2 Emissions (CO2 Ordinance), SR 641.711",2013,Executive,,"Adaptation; Carbon Pricing; Energy Demand; Energy Supply; Institutions / Administrative arrangements; REDD+ and LULUCF; Research and development; Transportation",Policy
Poland,"Polish National Strategy for Adaptation to climate Change (SAP 2020)",2013,Executive,Adaptation,"Adaptation; Institutions / Administrative arrangements; Research and development",Strategy
"European Union","Regulation (EU) No 1293/2013 on the establishment of a Programme for the Environment and Climate Action (LIFE) and repealing Regulation (EC) No 614/2007",2013,Legislative,No,"Adaptation; Energy Demand; Energy Supply; REDD+ and LULUCF","EU regulation"
Iceland,"Regulation no. 70/2013; amended by no. 823/2013 (Regulation of Emissions Permits for Operators working in the EU Emission Trading System)",2013,Executive,No,"Carbon Pricing",Regulation/rules
Croatia,"Regulation on the adoption of the Plan for the air protection, protection of the ozone layer and climate change mitigation in the Republic of Croatia for the period 2013-2017",2013,Executive,No,"Carbon Pricing; Energy Demand; Energy Supply; Institutions / Administrative arrangements; Research and development; Transportation",Plan
Portugal,"Resolution of Council of Ministers 20/2013 establishing the National Action Plan for Energy Efficiency (PNAEE 2016) and the National Action Plan for Renewable Energy (PNAER 2020)",2013,Executive,No,"Energy Demand; Energy Supply; Institutions / Administrative arrangements",Plan
Uzbekistan,"Resolution of the Cabinet of Ministers No. 142 Action Plan of the Republic of Uzbekistan for Environmental Protection for the years 2013-2017",2013,Executive,,"Research and development",Plan
Spain,"Royal Decree 233/2013, on energy saving of rental housing, building restoration and urban regeneration and renovation",2013,Executive,,"Energy Demand",Decree/order/ordinance
Spain,"Royal Decree 238/2013, incorporates the regulation on thermal installations in buildings",2013,Executive,,"Energy Demand",Decree/order/ordinance
Spain,"Royal Decree 635/2013, developing the “Plan to Promote the Environment in the hotel sector PIMA SOL\ for the energy renovation of its installations, and regulating the further acquisition of carbon credits by the Carbon Fund for a sustainable economy",2013,Executive,,"Carbon Pricing; Energy Demand; Institutions / Administrative arrangements",Decree/order/ordinance
Spain,"Royal Decree Law 2/2013, which implements urgent measures in the electricity and financial sectors",2013,Executive,,"Energy Demand; Energy Supply; Institutions / Administrative arrangements",Decree/order/ordinance
Denmark,"The Danish Climate Policy Plan",2013,Executive,,"Energy Demand; Energy Supply; Institutions / Administrative arrangements; REDD+ and LULUCF; Transportation",Plan
Romania,"The National Climate Change Strategy (2013-2020)",2013,Executive,"Mitigation and adaptation","Adaptation; Energy Demand; Energy Supply; Institutions / Administrative arrangements; REDD+ and LULUCF",Resolution
Italy,"Thermal account, incentive schemes set up by Ministerial Decree No 12/2012",2013,Executive,,"Energy Demand; Energy Supply; Institutions / Administrative arrangements",Decree/order/ordinance
Norway,"White Paper on Climate Change Adaptation, Meld St. 33 (2012-2013)",2013,Executive,Adaptation,Adaptation,Policy
Iceland,"2012 Act no. 70 on Climate Change",2012,Legislative,"Mitigation and adaptation","Adaptation; Carbon Pricing; Energy Supply; Institutions / Administrative arrangements; REDD+ and LULUCF; Research and development",Law
Andorra,"24-10-2012 decree approving the conditions of purchase of electricity generated by photovoltaic installations",2012,Executive,,"Energy Supply",Decree/order/ordinance
"Czech Republic","Act No. 165/2012 Coll. on supported energy sources and on amendment to some laws",2012,Legislative,,"Energy Supply",Law
Slovakia,"Act No. 250/2012 on regulation of network industries as amended",2012,Legislative,,"Energy Supply; Institutions / Administrative arrangements",Law
Slovakia,"Act No. 251/2012 Coll. on Energy and on change of certain acts",2012,Legislative,,"Energy Supply; Institutions / Administrative arrangements",Law
Slovakia,"Act No. 314/2012 Coll. on regular inspection of heating systems and air conditioning systems",2012,Legislative,,"Energy Demand",Law
Slovakia,"Act No. 373/2012 Coll. on emergency stocks of oil and oil products and amending the Act on the promotion of renewable energy sources and high efficiency cogeneration",2012,Legislative,,"Energy Supply; Institutions / Administrative arrangements",Law
Slovakia,"Act No. 414/2012 Coll. on Emission Trading",2012,Legislative,,"Carbon Pricing; Institutions / Administrative arrangements",Law
Denmark,"Action Plan for a climate-proof Denmark",2012,Executive,Adaptation,"Adaptation; Institutions / Administrative arrangements; Research and development",Plan
Switzerland,"Adaptation to Climate Change in Switzerland: Goals, Challenges and Fields of Action (UD-1055-E) (Swiss National Adaptation Strategy: Part I) and Adaptation to Climate Change in Switzerland: Plan of Action 2014-2019 (1081-F) (Swiss National Adaptation Strategy: Part II)",2012,Executive,Adaptation,"Adaptation; Institutions / Administrative arrangements; Research and development",Plan
Germany,"Carbon Capture and Storage Act (KSpG)",2012,Legislative,,"Energy Supply",Law
Luxembourg,"Climate Pact with the Municipalities",2012,Legislative,,"Institutions / Administrative arrangements",Law
Norway,"Climate Settlement, Innst. 390 S (2011–2012)",2012,Executive,Mitigation,"Energy Demand; Energy Supply; REDD+ and LULUCF; Transportation",Policy
Andorra,"Decree creating the Office of Energy",2012,Executive,,"Energy Demand; Energy Supply; Institutions / Administrative arrangements",Decree/order/ordinance
Portugal,"Decree-Law 56/2012 on the Portuguese Environment Agency (APA I.P)",2012,Executive,,"Institutions / Administrative arrangements","Decree law"
Netherlands,"Delta Act on Water Safety and Fresh Water Supply (Delta Act)",2012,Legislative,,"Adaptation; Institutions / Administrative arrangements",Law
Liechtenstein,"Emissions Trading Act",2012,Legislative,No,"Carbon Pricing",Law
Ireland,"Energy (Miscellaneous Provisions) Act 2012, Number 3 of 2012",2012,Legislative,,"Energy Demand; Energy Supply; Institutions / Administrative arrangements",Law
Croatia,"Energy Act",2012,Legislative,No,"Energy Demand; Energy Supply; Institutions / Administrative arrangements",Law
Denmark,"Energy Agreement 2012-2020",2012,Legislative,,"Adaptation; Energy Demand; Energy Supply; Research and development; Transportation",Law
"European Union","Energy Efficiency (Directive 2012/27/EU, amending Directives 2009/125/EC and 2010/30/EU and repealing Directives 2004/8/EC and 2006/32/EC)",2012,Legislative,No,"Energy Demand; Energy Supply; Institutions / Administrative arrangements","EU directive"
Turkey,"Energy Efficiency Strategy Paper 2012-2023",2012,Executive,,"Adaptation; Energy Supply; Institutions / Administrative arrangements; Transportation",Strategy
"San Marino","Environmental Code (Delegated Decree no 44 of April 27th, 2012)",2012,Legislative,,"Institutions / Administrative arrangements",Law
Luxembourg,"Global Strategy for a Sustainable Mobility (MODU)",2012,Executive,,Transportation,Strategy
Luxembourg,"Law on carbon dioxide geological storage and environmental responsibility",2012,Legislative,mitigation,"Energy Supply; Research and development",Law
Romania,"Law on Electrical Energy and Natural Gases, 123/2012",2012,Legislative,,"Energy Demand; Energy Supply; Institutions / Administrative arrangements",Law
"Czech Republic","Minimum biofuel content for transportation fuels (Act No. 201/2012 Coll., on the protection of atmosphere – Clean Air Act)",2012,Legislative,,Transportation,Law
Malta,"National Climate Change Adaptation Strategy",2012,Executive,Adaptation,"Adaptation; Energy Demand; Institutions / Administrative arrangements",Strategy
Latvia,"National Development Plan of Latvia for 2014–2020",2012,Executive,No,"Energy Demand",Plan
Malta,"National Environment Policy",2012,Executive,,"Adaptation; Energy Demand; Energy Supply; REDD+ and LULUCF; Research and development; Transportation",Policy
Lithuania,"National Forest Sector Development Programme for 2012-2020",2012,Executive,No,"REDD+ and LULUCF",Programme
Malta,"National Strategy for the introduction of electric mobility in Malta and Gozo",2012,Executive,,"Energy Demand; Transportation",Strategy
Turkmenistan,"National Strategy on Climate Change",2012,Executive,"Mitigation and adaptation","Adaptation; Energy Demand; Energy Supply; Institutions / Administrative arrangements; REDD+ and LULUCF; Research and development; Transportation",Strategy
Switzerland,"Regulation on the CO2 Emission for New Passenger Vehicles",2012,Executive,,"Energy Demand; Transportation",Regulation/rules
"Czech Republic","State Environmental Policy (2012-2020)",2012,Executive,,"Adaptation; Energy Demand; Energy Supply",Policy
Lithuania,"Strategy for the National Climate Change Management Policy until 2050",2012,Executive,"Mitigation and adaptation","Adaptation; Carbon Pricing; Energy Demand; Energy Supply; Institutions / Administrative arrangements; REDD+ and LULUCF; Research and development; Transportation",Strategy
Austria,"The Austrian Strategy for Adaption to Climate Change",2012,Executive,Adaptation,Adaptation,Strategy
France,"Thermal Regulation 2012 (RT 2012)",2012,Executive,,"Energy Demand",Policy
Estonia,"‘Estonia 2020’ National Reform Programme",2011,Executive,Mitigation,"Energy Demand; Energy Supply; Transportation",Programme
Hungary,"Act no. 117 of 2010 concerning the promotion of the use of renewable energy for transport and the greenhouse effect reduction of energy used for transport purposes  (Biofuels Act)",2011,Legislative,,Transportation,Law
Hungary,"Act No.86 of 2011 on Electricity (Electricity Act)",2011,Legislative,,"Energy Demand; Energy Supply",Law
Sweden,"Act on Electricity certificates: Act No. 2011:1200 and Regulation on Electricity certificates – Regulation No. 2011:1480",2011,Legislative,,"Carbon Pricing; Energy Supply",Law
Finland,"Act on State guarantees and export guarantees granted to industry for investments promoting environmental protection (609/1973)",2011,Legislative,,"Energy Demand; Energy Supply; Institutions / Administrative arrangements",Law
Croatia,"Air Protection Law",2011,Legislative,Mitigation,"Adaptation; Energy Demand; Energy Supply; Institutions / Administrative arrangements; Research and development; Transportation",Law
"United Kingdom","Carbon Plan",2011,Executive,,"Energy Demand; Energy Supply; Transportation",Plan
Turkey,"Climate Change Action Plan 2011-2023",2011,Executive,"Mitigation and adaptation","Adaptation; Energy Supply; Institutions / Administrative arrangements; Transportation",Plan
Austria,"Climate Protection Act",2011,Legislative,Mitigation,"Institutions / Administrative arrangements",Law
Slovakia,"Creation of the High Level Committee for Co-ordination of Climate Change Policy (Coordination Committee), Resolution of the Slovak Government No. 821/2011",2011,Executive,,"Institutions / Administrative arrangements",Policy
Andorra,"Decree on the granting of aid for the installation of renewable energy utilization systems in buildings",2011,Executive,,"Energy Demand",Decree/order/ordinance
Turkey,"Decree-Laws 644 and 648 on the organisation and duties of the Ministry of Environment and Urban Planning",2011,Executive,No,"Institutions / Administrative arrangements; Research and development","Decree law"
Norway,"Electricity Certificates Act, No. 39 of 2011",2011,Legislative,,"Energy Supply",Law
"European Union","Emission performance standards for new light commercial vehicles (Regulation (EU) No. 510/2011 setting emission performance standards for new light commercial vehicles as part of the Union’s integrated approach to reduce CO2 emissions from light-duty vehicles",2011,Legislative,No,Transportation,"EU regulation"
Monaco,"Energy Climate Plan",2011,Executive,"Mitigation and adaptation","Adaptation; Energy Demand; Energy Supply",Plan
Spain,"Energy Efficiency Action Plan 2011-2020",2011,Executive,,"Energy Demand; Transportation",Plan
Poland,"Energy Efficiency Law",2011,Legislative,,"Energy Demand; Institutions / Administrative arrangements",Law
Bulgaria,"Energy from Renewable Sources Act",2011,Legislative,,"Energy Supply",Law
Netherlands,"Energy Report",2011,Executive,,"Carbon Pricing; Energy Demand; Energy Supply; Research and development; Transportation",Policy
Slovakia,"Establishment of sustainability criteria and targets to reduce greenhouse gas emissions from fuels, Decree of Ministry of Environment No. 271/2011 Coll.",2011,Executive,,"Energy Supply; REDD+ and LULUCF",Decree/order/ordinance
Austria,"Feed-in Tariff Decree",2011,Executive,,"Energy Supply",Decree/order/ordinance
"United Kingdom","Finance Act 2011",2011,Legislative,,"Carbon Pricing",Law
Bulgaria,"Forestry Act and National Strategy for the Development of the Forest Sector 2013-2020",2011,Legislative,,"REDD+ and LULUCF",Law
Sweden,"Government Bill (2009/2010: 172): Nuclear Power -opening the way for a generation change &#038; Government Bill (2009/2010:173): Nuclear Power ? Increased Liability",2011,Legislative,,"Energy Supply; Institutions / Administrative arrangements; Research and development",Law
Romania,"Government Decision regarding the use of bio fuels and bio liquids 935/2011 amended and complimented with 918/2012",2011,Executive,,"Energy Demand; Transportation",Policy
Austria,"Green Electricity Act",2011,Legislative,,"Energy Demand",Law
Germany,"Grid Expansion Acceleration Act (NABEG)",2011,Legislative,,"Energy Supply; Institutions / Administrative arrangements",Law
Spain,"Law 2/2011, on Spain’s Sustainable Economy, regulated by Royal Decree 1494/2011, of 24 October 2011",2011,Legislative,,"Carbon Pricing; Energy Demand; Energy Supply; Institutions / Administrative arrangements; Transportation",Law
Greece,"Law 4001/2011 on the Operation of Electricity and Gas Energy Markets, for Exploration, Production and Transmission Networks of Hydrocarbons and other provisions",2011,Legislative,,"Energy Supply",Law
Romania,"Law approving Government Emergency Ordinance no. 18/2009 on increasing the energy efficiency of residential buildings, 158/2011",2011,Legislative,,"Energy Demand",Law
Kyrgyzstan,"Law no. 137 “On the energy efficiency of buildings”",2011,Legislative,No,"Energy Demand",Law
Kazakhstan,"Law on Energy Saving",2011,Legislative,,"Energy Demand; Energy Supply",Law
France,"National Climate Change Adaptation Plan",2011,Executive,Adaptation,"Adaptation; Institutions / Administrative arrangements",Plan
Moldova,"National Program for Energy Efficiency 2011-2020",2011,Executive,No,"Energy Demand; Energy Supply; Transportation",Programme
Spain,"Plan for Renewable Energy in Spain PER 2011-2020",2011,Executive,,"Energy Supply; Institutions / Administrative arrangements; Research and development",Plan
Serbia,"Regulation Establishing the Methodology for Determining the Preparation of Preliminary Flood Risk Assessment",2011,Executive,No,Adaptation,Regulation/rules
Spain,"Royal Decree creating the Interministerial Commission for Climate Change",2011,Executive,,"Institutions / Administrative arrangements",Decree/order/ordinance
Turkey,"Turkey’s National Climate Change Adaptation Strategy and Action Plan",2011,Executive,Adaptation,Adaptation,Strategy
"United Kingdom","UK Renewable Energy Roadmap",2011,Executive,,"Energy Supply; Transportation",Policy
Finland,"Act 1396/2010 on Production Subsidy for Electricity Produced from Renewable Energy Sources (1396/2010) and accompanying Decree 1397/2010",2010,Legislative,,"Carbon Pricing; Energy Supply",Act
Belarus,"Act No. 204 on renewable energy sources",2010,Legislative,,"Energy Supply; Institutions / Administrative arrangements",Law
Finland,"Act on Aviation Emissions Trading (34/2010)",2010,Legislative,,"Institutions / Administrative arrangements; Transportation",Law
"United Kingdom","Carbon Reduction Commitment Energy Efficiency Scheme",2010,Legislative,,"Energy Demand",Law
Turkey,"Climate Change Strategy 2010-2020",2010,Executive,,"Adaptation; Energy Demand; Energy Supply; REDD+ and LULUCF; Research and development; Transportation",Strategy
Netherlands,"Crisis and Recovery Act",2010,Legislative,,"Adaptation; Institutions / Administrative arrangements",Law
Belarus,"Decree No. 625 on “Some GHG Emission Reduction Issues”",2010,Executive,,"Carbon Pricing; Energy Demand; Energy Supply; Institutions / Administrative arrangements",Decree/order/ordinance
Portugal,"Decree-Law 39/2010 on electric mobility, last amended by Decree-Law 90/2014",2010,Executive,,"Energy Demand; Institutions / Administrative arrangements; Research and development; Transportation","Decree law"
Portugal,"Decree-Law No. 117/2010, regulating sustainability criteria for production and use of biofuel and bio liquids, amended by Decree-Law 6/2012",2010,Executive,,"Energy Supply; Institutions / Administrative arrangements; Transportation","Decree law"
Ireland,"Energy (Biofuel Obligation and Miscellaneous Provisions) Act 2010 (No. 11 of 2010) of the National Oil Reserves Agency Act 2007 (No.7 of 2007)",2010,Legislative,,"Energy Supply; Institutions / Administrative arrangements; Transportation",Law
Germany,"Energy and Climate Fund Act (EKFG)",2010,Legislative,,"Energy Demand; Energy Supply; Institutions / Administrative arrangements",Law
Germany,"Energy Concept for an Environmentally Sound, Reliable and Affordable Energy Supply",2010,Executive,,"Energy Supply; Institutions / Administrative arrangements",Policy
Italy,"Energy efficient buildings and biofuel standards (2010 Finance Law)",2010,Legislative,,"Carbon Pricing; Energy Demand; Energy Supply",Law
"European Union","Energy labelling (Directive 2010/30/EU and Regulation 2017/1369 on the indication by labelling and standard product information of the consumption of energy and other resources by energy-related products)",2010,Legislative,No,"Energy Demand; Institutions / Administrative arrangements","EU directive"
Austria,"Energy Strategy",2010,Executive,,"Energy Demand; Energy Supply",Strategy
"Macedonia (the former Yugoslav Republic of)","Energy Strategy",2010,Executive,,"Energy Supply",Strategy
"United Kingdom","Feed-in Tariffs for renewable electricity",2010,Legislative,,"Energy Supply",Law
Finland,"Flood Risk Management Act (No. 620/2010)",2010,Legislative,,"Adaptation; Institutions / Administrative arrangements",Law
Serbia,"Forest Law",2010,Legislative,No,"REDD+ and LULUCF",Law
Hungary,"Governmental Decree No.343 of 2010 concerning the requisites and certification of sustainable biofuel production",2010,Executive,,"Energy Supply",Decree/order/ordinance
France,"Grenelle II",2010,Legislative,,"Carbon Pricing; Energy Demand; Energy Supply; Research and development",Law
Greece,"Law 3831/2010 on “Revision of the vehicle taxes regime for vehicles, abolishment of the vehicles recycling measures (scrappage scheme) and measures for tackling atmospheric pollution”",2010,Legislative,,Transportation,Law
Greece,"Law 3851/2010 on “Accelerating the development of Renewable Energy Sources to address climate change and other provisions on jurisdiction of the Ministry of Environment, Energy and Climate Change”",2010,Legislative,,"Energy Supply; Institutions / Administrative arrangements",Law
Greece,"Law 3855/2010 on “Measures to improve energy efficiency in end?use, energy services and other provisions”",2010,Legislative,,"Energy Demand",Law
Greece,"Law 3889/2010 Financing Environmental Interventions, Green Fund, Ratification of Forest Maps and other provisions",2010,Legislative,,"Energy Demand; Institutions / Administrative arrangements; REDD+ and LULUCF",Law
Andorra,"Law 85/2010, of 18 November, provisional measures relating to the regime of electricity",2010,Legislative,,"Energy Supply",Law
Andorra,"Law 93/2010, of 16 December on measures to promote economic activity and social rationalization and optimization of the resources of the government",2010,Legislative,,"Energy Demand",Law
Tajikistan,"Law No.587 on Promoting the Use of Renewable Energy (Renewable Energy Law)",2010,Legislative,,"Energy Demand; Energy Supply; Transportation",Law
Belgium,"National Climate Change Adaptation Strategy",2010,Executive,Adaptation,"Adaptation; Institutions / Administrative arrangements",Strategy
Hungary,"National Renewable Energy Action Plan (NREAP) for 2010-2020",2010,Executive,,"Adaptation; Energy Demand; Energy Supply",Plan
Spain,"National Renewable Energy Action Plan PANER 2011-2020",2010,Executive,,"Energy Supply; Institutions / Administrative arrangements; Research and development",Plan
Norway,"Offshore Energy Act No. 21 of 2010",2010,Legislative,,"Energy Supply; Institutions / Administrative arrangements",Law
Sweden,"Regulation on State Subsidies for Solar Panels – Regulation No. 2009:689, updated/ amended by Regulation no. 2011:1473",2010,Executive,,"Energy Supply; Research and development",Regulation/rules
Portugal,"Resolution of Council of Ministers 93/2010 mandating the development of a new regulatory framework for post-2010 climate policy in Portugal",2010,Executive,No,"Institutions / Administrative arrangements",Policy
Spain,"Royal Decree 903/2010, on the Assessment and Management of Flood Risk",2010,Executive,,"Adaptation; Institutions / Administrative arrangements; REDD+ and LULUCF; Research and development",Decree/order/ordinance
Italy,"Special fund to support the implementation of energy efficiency targets (Decree Law no. 40)",2010,Executive,,"Energy Demand; Institutions / Administrative arrangements","Decree law"
Belarus,"State Building Sector Development Concept for 2011-2020 (Resolution of the Council of Ministers of the Republic of Belarus No. 1589)",2010,Executive,,"Energy Demand; Research and development",Policy
Armenia,"Strategy for Sustainable Rural and Agricultural Development for the period of 2010-2020",2010,Executive,No,Adaptation,Strategy
Slovenia,"Strategy of adaptation of the Slovenian agriculture and forestry sectors to climate change",2010,Executive,,Adaptation,Strategy
Belarus,"Strategy of technological development of Belarus up to 2015 (Resolution of the Council of Ministers of the Republic of Belarus No. 1420)",2010,Executive,,"Energy Demand; Energy Supply",Resolution
Latvia,"Sustainable Development Strategy for Latvia until 2030",2010,Executive,No,"Energy Demand; Energy Supply; Research and development; Transportation",Strategy
Sweden,"The Building and Planning Act (SFS 2010:900)",2010,Legislative,,"Adaptation; Energy Demand",Law
"United Kingdom","UK Flood and Water Management Act &#8211; 2010",2010,Legislative,,Adaptation,Act
Iceland,"2009 Act no. 129 (on Environmental and Resource Taxes)",2009,Legislative,No,"Carbon Pricing; Energy Demand",Law
"European Union","2020 Climate and Energy Package (contains Directive 2009/29/EC,  Directive 2009/28/EC, Directive 2009/31/EC and Decision No. 406/2009/EC of the Parliament and the Council ; see below)",2009,Legislative,Mitigation,"Carbon Pricing; Energy Demand; Energy Supply; Institutions / Administrative arrangements; REDD+ and LULUCF; Transportation","EU decision"
Poland,"Act on the System to Manage the Emissions of Greenhouse Gases and Other Substances",2009,Legislative,,"Institutions / Administrative arrangements",Law
Sweden,"Action Plan for a fossil-fuel independent vehicle fleet",2009,Executive,,"Carbon Pricing; Research and development; Transportation",Plan
Sweden,"An Integrated Climate and Energy Policy",2009,Legislative,,"Adaptation; Carbon Pricing; Energy Demand; Energy Supply; Institutions / Administrative arrangements; REDD+ and LULUCF; Research and development; Transportation",Law
"European Union","Clean and energy-efficient road transport vehicles (Directive 2009/33/EC on the promotion of clean and energy-efficient road transport vehicles)",2009,Legislative,No,Transportation,"EU directive"
Italy,"Cleaner vehicle purchase incentives (Decree Law No. 5 of 2009)",2009,Legislative,,Transportation,"Decree law"
Russia,"Climate Doctrine of the Russian Federation",2009,Executive,Mitigation,"Adaptation; Energy Demand; Energy Supply; Institutions / Administrative arrangements; Research and development",Policy
"European Union","Commission Decisions 2009/300/EC and 2018/59 on the ecological criteria for the award of the Community Eco-label to televisions",2009,Legislative,No,"Energy Demand; Institutions / Administrative arrangements","EU decision"
Bulgaria,"Early-warning system in case of disasters (Ordinance 26/2009 of the Council of Ministers)",2009,Executive,,"Adaptation; Institutions / Administrative arrangements",Decree/order/ordinance
"European Union","Eco-design (Directive 2009/125/EC establishing a framework for the setting of ecodesign requirements for energy-related products (recast))",2009,Legislative,Mitigation,"Energy Demand","EU directive"
"European Union","Effort Sharing Decision (Decision No. 406/2009/EC on the effort of Member States to reduce their greenhouse gas emissions to meet the Community’s greenhouse gas emission reduction commitments up to  2020)",2009,Legislative,No,"Energy Demand; REDD+ and LULUCF; Transportation","EU decision"
